{
  "ts": "2026-05-09T07:00:00Z",
  "level": "warn",
  "target": "mcp_agent_mail::boot_check",
  "name": "boot_check_finding",
  "fields": {
    "repo_slug": "data-projects-demo",
    "caller": "startup.boot_check",
    "args_hash": "0123456789abcdef0123456789abcdef0123456789abcdef0123456789abcdef",
    "duration_ms": 0,
    "outcome": "error",
    "git_version": "libgit2",
    "mode": "warn",
    "project": "project-a",
    "kind": "orphan_refs",
    "detail": "refs/stash target is missing"
  }
}
