{
  "ts": "2026-05-09T07:00:00Z",
  "level": "error",
  "target": "mcp_agent_mail::boot_check",
  "name": "boot_check_timeout_exceeded",
  "fields": {
    "repo_slug": "data-projects-demo",
    "caller": "startup.boot_check",
    "args_hash": "0123456789abcdef0123456789abcdef0123456789abcdef0123456789abcdef",
    "duration_ms": 30001,
    "outcome": "error",
    "git_version": "libgit2",
    "mode": "abort",
    "total_projects": 50,
    "scanned_projects": 49,
    "timeout_ms": 30000
  }
}
